{"type": "config", "name": "beat-crew-variety", "metricName": "variety", "metricUnit": "pts", "bestDirection": "higher", "noiseFloor": 0.15, "maxRuns": 60, "maxSeconds": null, "targetMetric": null, "startedAt": 1784326456}
{"run": 1, "commit": "e669b82", "metric": 13.53, "metrics": {"worst_dj": 11.656, "seed_rate": 0.398, "guest_rate": 0.528}, "status": "keep", "description": "baseline: candidate = live roster (style v5)", "timestamp": 1784329309, "segment": 0}
{"run": 2, "commit": "121fafb", "metric": 14.068, "metrics": {"worst_dj": 12.02, "seed_rate": 0.435, "guest_rate": 0.528}, "status": "keep", "description": "library.p +0.15 for the flagged trap trio (groove seeds break their sparse-grammar clustering)", "timestamp": 1784329310, "segment": 0}
{"run": 3, "commit": "121fafb", "metric": 14.023, "metrics": {"worst_dj": 11.892, "seed_rate": 0.444, "guest_rate": 0.519}, "status": "discard", "description": "kick hits ceiling +1 for sparse grammars (worse; also leans against the sparse-bed rule)", "timestamp": 1784329311, "segment": 0}
{"run": 4, "commit": "121fafb", "metric": 14.062, "metrics": {"worst_dj": 11.701, "seed_rate": 0.444, "guest_rate": 0.546}, "status": "discard", "description": "widen backbeat mode weights toward uniform (within noise of best; worst_dj down)", "timestamp": 1784329312, "segment": 0}
{"run": 5, "commit": "121fafb", "metric": 13.948, "metrics": {"worst_dj": 11.542, "seed_rate": 0.389, "guest_rate": 0.546}, "status": "discard", "description": "flatten kick weight maps w^0.7 (bank skeletons dominate, freestyle rarely fires)", "timestamp": 1784329313, "segment": 0}
{"run": 6, "commit": "121fafb", "metric": 13.835, "metrics": {"worst_dj": 11.56, "seed_rate": 0.472, "guest_rate": 0.565}, "status": "discard", "description": "library.p +0.1 for the other six DJs (small genre pools repeat seeds)", "timestamp": 1784329314, "segment": 0}
{"run": 7, "commit": "121fafb", "metric": 14.12, "metrics": {"worst_dj": 12.02, "seed_rate": 0.444, "guest_rate": 0.528}, "status": "discard", "description": "trap trio library.p +0.1 more (delta +0.05 inside the noise band)", "timestamp": 1784329315, "segment": 0}
{"run": 8, "commit": "121fafb", "metric": 14.04, "metrics": {"worst_dj": 12.02, "seed_rate": 0.435, "guest_rate": 0.519}, "status": "discard", "description": "ghost ceilings +1 for 90s heads (kicks dominate the metric)", "timestamp": 1784329316, "segment": 0}
{"run": 9, "commit": "4bd1750", "metric": 13.988, "metrics": {"worst_dj": 12.02, "seed_rate": 0.435, "guest_rate": 0.528}, "status": "discard", "description": "Night Metro library tags +garage +breakbeat (bigger seed pool)", "timestamp": 1784329317, "segment": 0}
{"run": 10, "commit": "4bd1750", "metric": 14.02, "metrics": {"worst_dj": 12.02, "seed_rate": 0.435, "guest_rate": 0.528}, "status": "discard", "description": "Rage Engine library tags +techno +electro", "timestamp": 1784329318, "segment": 0}
{"run": 11, "commit": "4bd1750", "metric": 14.182, "metrics": {"worst_dj": 12.02, "seed_rate": 0.435, "guest_rate": 0.528}, "status": "discard", "description": "New Math breakbeat 2->3, +house tag (near-miss: +0.11, under the floor)", "timestamp": 1784329319, "segment": 0}
{"run": 12, "commit": "4bd1750", "metric": 14.061, "metrics": {"worst_dj": 11.955, "seed_rate": 0.435, "guest_rate": 0.528}, "status": "discard", "description": "Chrome Dial kick double_p 0.45->0.6", "timestamp": 1784329320, "segment": 0}
{"run": 13, "commit": "4bd1750", "metric": 14.053, "metrics": {"worst_dj": 11.881, "seed_rate": 0.435, "guest_rate": 0.528}, "status": "discard", "description": "Glass Cat kick w: open steps 3,6,13", "timestamp": 1784329321, "segment": 0}
{"run": 14, "commit": "4bd1750", "metric": 14.083, "metrics": {"worst_dj": 12.02, "seed_rate": 0.435, "guest_rate": 0.528}, "status": "discard", "description": "Otto Grit kick double_p 0.3->0.45", "timestamp": 1784329322, "segment": 0}
{"run": 15, "commit": "4bd1750", "metric": 14.068, "metrics": {"worst_dj": 12.02, "seed_rate": 0.435, "guest_rate": 0.528}, "status": "discard", "description": "Sunday Chop hats: eighths->0.3, broken->0.4", "timestamp": 1784329323, "segment": 0}
{"run": 16, "commit": "4bd1750", "metric": 14.051, "metrics": {"worst_dj": 12.02, "seed_rate": 0.435, "guest_rate": 0.528}, "status": "discard", "description": "Night Metro hat roll_n [1,2]->[1,3]", "timestamp": 1784329324, "segment": 0}
{"run": 17, "commit": "4bd1750", "metric": 14.087, "metrics": {"worst_dj": 12.02, "seed_rate": 0.435, "guest_rate": 0.528}, "status": "discard", "description": "Cutz library.p 0.3->0.15 (less seeding, no signal)", "timestamp": 1784329325, "segment": 0}
{"run": 18, "commit": "4bd1750", "metric": 14.081, "metrics": {"worst_dj": 12.02, "seed_rate": 0.435, "guest_rate": 0.528}, "status": "discard", "description": "trap trio library.p +0.05 fine step (noise)", "timestamp": 1784329326, "segment": 0}
{"type":"config","name":"beat-crew-variety-lib174","metricName":"variety","metricUnit":"pts","bestDirection":"higher","noiseFloor":0.20,"maxRuns":40,"maxSeconds":null,"targetMetric":null,"startedAt":1784345671}
{"run":19,"commit":"dc98acb","metric":13.713,"metrics":{"worst_dj":12.039,"seed_rate":0.426,"n_seeds":3},"status":"keep","description":"segment-1 baseline: candidate in the 174-seed library","timestamp":1784345687,"segment":1}
{"run":20,"commit":"dc98acb","metric":13.782,"metrics":{"worst_dj":14.221,"seed_rate":0.000,"n_seeds":3},"status":"discard","description":"New Math tags: breakbeat 2->3, +house","timestamp":1784345709,"segment":1}
{"run":21,"commit":"dc98acb","metric":13.736,"metrics":{"worst_dj":14.058,"seed_rate":0.000,"n_seeds":3},"status":"discard","description":"Night Metro tags +garage +breakbeat","timestamp":1784345720,"segment":1}
{"run":22,"commit":"dc98acb","metric":13.704,"metrics":{"worst_dj":13.704,"seed_rate":0.000,"n_seeds":3},"status":"discard","description":"Rage Engine tags +electro","timestamp":1784345728,"segment":1}
{"run":23,"commit":"dc98acb","metric":13.726,"metrics":{"worst_dj":13.726,"seed_rate":0.000,"n_seeds":3},"status":"discard","description":"Otto Grit tags +soul","timestamp":1784345739,"segment":1}
{"run":24,"commit":"dc98acb","metric":13.726,"metrics":{"worst_dj":13.726,"seed_rate":0.000,"n_seeds":3},"status":"discard","description":"Crate Prophet tags +motown","timestamp":1784345739,"segment":1}
{"run":25,"commit":"dc98acb","metric":13.713,"metrics":{"worst_dj":13.713,"seed_rate":0.000,"n_seeds":3},"status":"discard","description":"Chrome Dial tags +electro","timestamp":1784345740,"segment":1}
{"run":23,"commit":"dc98acb","metric":13.726,"metrics":{"worst_dj":13.726,"seed_rate":0.000,"n_seeds":3},"status":"discard","description":"Otto Grit tags +soul","timestamp":1784345746,"segment":1}
{"run":24,"commit":"dc98acb","metric":13.726,"metrics":{"worst_dj":13.726,"seed_rate":0.000,"n_seeds":3},"status":"discard","description":"Crate Prophet tags +motown","timestamp":1784345746,"segment":1}
{"run":25,"commit":"dc98acb","metric":13.713,"metrics":{"worst_dj":13.713,"seed_rate":0.000,"n_seeds":3},"status":"discard","description":"Chrome Dial tags +electro","timestamp":1784345746,"segment":1}
{"run":26,"commit":"dc98acb","metric":13.710,"metrics":{"worst_dj":13.710,"seed_rate":0.000,"n_seeds":3},"status":"discard","description":"Glass Cat minimal weight 2->3","timestamp":1784345755,"segment":1}
{"run":27,"commit":"dc98acb","metric":13.637,"metrics":{"worst_dj":13.637,"seed_rate":0.000,"n_seeds":3},"status":"discard","description":"Sunday Chop motown 2->3","timestamp":1784345762,"segment":1}
{"run":28,"commit":"dc98acb","metric":13.752,"metrics":{"worst_dj":13.752,"seed_rate":0.000,"n_seeds":3},"status":"discard","description":"Cutz funk 1->2","timestamp":1784345769,"segment":1}
{"run":29,"commit":"dc98acb","metric":13.694,"metrics":{"worst_dj":13.694,"seed_rate":0.000,"n_seeds":3},"status":"discard","description":"non-trio six DJs library.p +0.1","timestamp":1784345777,"segment":1}
{"run":30,"commit":"dc98acb","metric":13.734,"metrics":{"worst_dj":13.734,"seed_rate":0.000,"n_seeds":3},"status":"discard","description":"trap trio library.p +0.05","timestamp":1784345784,"segment":1}
{"run":31,"commit":"d4c5901","metric":13.789,"metrics":{"worst_dj":13.789,"seed_rate":0.000,"n_seeds":3},"status":"discard","description":"New Math jungle 1->2, dnb 1->2","timestamp":1784345792,"segment":1}
{"run":32,"commit":"d4c5901","metric":13.758,"metrics":{"worst_dj":13.758,"seed_rate":0.000,"n_seeds":3},"status":"discard","description":"Night Metro cloud-rap 2->3","timestamp":1784345799,"segment":1}
{"run":33,"commit":"d4c5901","metric":13.598,"metrics":{"worst_dj":13.598,"seed_rate":0.000,"n_seeds":3},"status":"discard","description":"Rage Engine drill 2->3","timestamp":1784345806,"segment":1}
{"run":34,"commit":"d4c5901","metric":13.756,"metrics":{"worst_dj":13.756,"seed_rate":0.000,"n_seeds":3},"status":"discard","description":"Otto Grit lofi 3->4","timestamp":1784345812,"segment":1}
{"run":35,"commit":"d4c5901","metric":13.714,"metrics":{"worst_dj":13.714,"seed_rate":0.000,"n_seeds":3},"status":"discard","description":"Crate Prophet soul 2->3","timestamp":1784345820,"segment":1}
